{
  "framework": "DASCP",
  "title": "Digital Asset Securities Control Principles",
  "version": "1.0 (May 2024)",
  "publishers": ["DTCC", "Clearstream", "Euroclear"],
  "source": "https://www.dtcc.com/-/media/DASCPWhitePaper.pdf",
  "license_note": "DASCP is a third-party copyrighted white paper (DTCC, Clearstream, Euroclear, in collaboration with BCG, May 2024). This file uses DASCP ids, official titles, and short paraphrased descriptions in our own words for interoperability between BPO and the DASCP framework. For the authoritative prose consult the source. Risk-to-control attributions follow the white paper's appendix and were cross-checked against the consolidated control-card figure on its page 14. Where the appendix grouped multiple risks under a shared Controls column (p.26 R2/R3; p.34 R20/R21) the per-link attribution required a subject-matter split; those specific links carry an inline `note` documenting the judgment and the p.14 cross-check.",

  "principles": [
    { "id": "P1", "title": "Legal Certainty",                   "priority": 1, "description": "Operations comply with applicable laws and regulations so that market integrity and investor confidence are preserved." },
    { "id": "P2", "title": "Regulatory Compliance",             "priority": 2, "description": "Alignment with regulatory frameworks underpins trust and safety in digital asset markets." },
    { "id": "P3", "title": "Resilience and Security",           "priority": 3, "description": "Infrastructure resists disruption, protects sensitive data, and maintains continuous operation of digital asset services." },
    { "id": "P4", "title": "Safeguarding Customer Assets",      "priority": 4, "description": "Smart-contract governance protects customer assets within the digital asset ecosystem." },
    { "id": "P5", "title": "Connectivity and Interoperability", "priority": 5, "description": "Transactions and settlement flow across diverse networks, enabling the seamless transfer and settlement of digital asset securities." },
    { "id": "P6", "title": "Operational Scalability",           "priority": 6, "description": "Standardized roles and smart-contract functions deliver efficiency and cost-effectiveness as the market grows." }
  ],

  "risks": [
    { "id": "R1",  "principle": "P1", "title": "Digital Asset Legal Noncompliance",                                  "description": "Loss or damages from failing to comply with the rapidly evolving global legal standards governing digital assets, including jurisdictional divergence and integration of digital and conventional asset frameworks." },
    { "id": "R2",  "principle": "P1", "title": "Unclear Settlement Finality",                                        "description": "Settlement finality is not achieved or the settlement status of a transaction is unclear." },
    { "id": "R3",  "principle": "P1", "title": "Smart Contract Legal Enforceability",                                "description": "Differences in legal status, recognition, and enforceability of smart contracts across jurisdictions affect cross-border transactions and asset custody." },
    { "id": "R4",  "principle": "P2", "title": "Unauthorized Investor Holdings",                                     "description": "Regulatory or financial harm if a non-compliant or unauthorized investor holds or transfers a digital asset security (e.g. accreditation, caps), excluding AML/CTF." },
    { "id": "R5",  "principle": "P2", "title": "Money Laundering and Terrorist Financing Risks",                     "description": "Platform misuse to obscure illicit funds or finance terrorism due to inadequate AML/CTF controls (KYC, transaction monitoring, reporting)." },
    { "id": "R6",  "principle": "P2", "title": "DLT Network Suitability / Adaptability",                             "description": "The DLT network may be unsuitable or unable to track evolving technological standards and regulations governing digital asset securities." },
    { "id": "R7",  "principle": "P2", "title": "Digital Asset Regulatory Noncompliance",                             "description": "Securities are non-compliant with potentially conflicting jurisdictional and asset-class securities regulations." },
    { "id": "R8",  "principle": "P2", "title": "Dispute Resolution",                                                 "description": "Decentralized DLT governance can hinder predictable dispute resolution across networks." },
    { "id": "R9",  "principle": "P2", "title": "Market Abuse",                                                       "description": "Insufficient surveillance to prevent market manipulation and uphold transparent, fair-market integrity." },
    { "id": "R10", "principle": "P3", "title": "Network Integrity",                                                  "description": "The integrity of the DLT network is compromised, e.g. via attacks, consensus issues, or supermajority-node manipulation." },
    { "id": "R11", "principle": "P3", "title": "Network Traffic Attack",                                             "description": "The DLT network is unavailable due to traffic-based attacks such as DDoS." },
    { "id": "R12", "principle": "P3", "title": "Smart Contract Integrity",                                           "description": "Smart-contract integrity on the DLT network is compromised by code defects or vulnerable external libraries." },
    { "id": "R13", "principle": "P3", "title": "Compromised Inter-Network Transfer",                                 "description": "Inter-network (cross-ledger) asset-transfer integrity is compromised." },
    { "id": "R14", "principle": "P3", "title": "Poisoned Oracle",                                                    "description": "Off-chain data is tampered with via a compromised oracle (poisoned-oracle scenario)." },
    { "id": "R15", "principle": "P3", "title": "Private Data Leakage",                                               "description": "Customers' personal data or proprietary data is leaked or stolen." },
    { "id": "R16", "principle": "P3", "title": "Exploited Consensus Algorithm",                                      "description": "The consensus mechanism is exploited, leading to unauthorized transfers, censorship, double-spending, or operational disruption of validation." },
    { "id": "R17", "principle": "P3", "title": "Quantum Computing Threat",                                           "description": "Quantum computing breaks asymmetric encryption, recovering private keys from public keys." },
    { "id": "R18", "principle": "P3", "title": "Interoperability Security Risks",                                    "description": "Security vulnerabilities arise from connecting the platform to other blockchain networks or traditional financial systems." },
    { "id": "R19", "principle": "P3", "title": "Network Outage",                                                     "description": "A single event (disaster, common failure point, pervasive issue) incapacitates multiple critical components, nodes, or networks, causing extensive disruption." },
    { "id": "R20", "principle": "P3", "title": "Smart Contract Defects",                                             "description": "DLT smart contracts cease to operate correctly because of software bugs or defects." },
    { "id": "R21", "principle": "P3", "title": "Complexity of Change Management",                                    "description": "DLT's decentralized, immutable nature complicates feature deployment, smart-contract updates, and patching of vulnerabilities, hindering timely adaptation." },
    { "id": "R22", "principle": "P3", "title": "Operational Errors",                                                 "description": "Errors, failures, or bottlenecks across the security life cycle arise when smart-contract code does not conform to standard market practice." },
    { "id": "R23", "principle": "P3", "title": "Asset Mismanagement",                                                "description": "Digital assets are lost, stolen, or erroneously transferred due to operational, system, or protocol weaknesses in asset management." },
    { "id": "R24", "principle": "P3", "title": "Immutable Transactions",                                             "description": "Immutability prevents reversing errors or returning securities to their original owners after a processing issue." },
    { "id": "R25", "principle": "P3", "title": "Inadequate Managerial Oversight",                                    "description": "Operations are compromised by insufficiently qualified management or weak governance structures, creating operational and regulatory exposure." },
    { "id": "R26", "principle": "P4", "title": "Asset Misappropriation",                                             "description": "Digital asset securities are misappropriated via code vulnerabilities, unauthorized intermediary actions, or fraudulent misuse of access privileges." },
    { "id": "R27", "principle": "P4", "title": "Unauthorized Smart Contract Access",                                 "description": "Unauthorized manipulation or exploitation of smart-contract functions via technical vulnerabilities, weak access controls, or compromised security protocols." },
    { "id": "R28", "principle": "P4", "title": "Insufficient Smart Contract Control",                                "description": "A custodian or intermediary lacks the necessary control over digital asset securities, tokens, or smart-contract functions." },
    { "id": "R29", "principle": "P4", "title": "Financial Institution Insolvency",                                   "description": "A broker-dealer or custodian becomes insolvent without protections ensuring customer assets are bankruptcy-remote." },